{
  "affected_l3": [
    {
      "affected_panels": [
        "A",
        "B",
        "C",
        "D",
        "E",
        "F"
      ],
      "l3_code": "L3-COM",
      "reanalysis_candidate": true
    }
  ],
  "consumer": "VNW_AGENT",
  "errors": [],
  "mode": "READ_ONLY_VALIDATE",
  "processed_at": "2026-09-08T03:55:14.703934+00:00",
  "release_id": "OB-20260907-001",
  "schema_version": "ob-vnw.vnw-receipt.v1",
  "source_results": [
    {
      "affected_panels_candidate": [
        "A",
        "C",
        "D",
        "E",
        "F"
      ],
      "errors": [],
      "evidence_level": "CORROBORATING",
      "lifecycle_status": "CONFIRMED",
      "publishable": true,
      "source_id": "OB-EA-COM-AI-FEASIBILITY-V2-MD",
      "valid": true
    },
    {
      "affected_panels_candidate": [
        "A",
        "C",
        "D",
        "E",
        "F"
      ],
      "errors": [],
      "evidence_level": "PRIMARY_SSOT",
      "lifecycle_status": "CONFIRMED",
      "publishable": true,
      "source_id": "OB-EA-COM-D1-D6-V1.0",
      "valid": true
    },
    {
      "affected_panels_candidate": [
        "A",
        "B",
        "C",
        "D",
        "E",
        "F"
      ],
      "errors": [],
      "evidence_level": "PRIMARY_SSOT",
      "lifecycle_status": "CONFIRMED",
      "publishable": true,
      "source_id": "OB-EA-COM-PROCESS-BLUEPRINT-V1.0",
      "valid": true
    },
    {
      "affected_panels_candidate": [
        "A",
        "B",
        "C",
        "D",
        "E",
        "F"
      ],
      "errors": [],
      "evidence_level": "CORROBORATING",
      "lifecycle_status": "CONFIRMED",
      "publishable": true,
      "source_id": "OB-EA-COM-VALUE-NODE-CATALOG-V3.62-MD",
      "valid": true
    },
    {
      "affected_panels_candidate": [
        "A",
        "B",
        "C",
        "D",
        "E",
        "F"
      ],
      "errors": [],
      "evidence_level": "PRIMARY_SSOT",
      "lifecycle_status": "CONFIRMED",
      "publishable": true,
      "source_id": "OB-EA-COM-VALUE-NODE-MAPPING-V2.19",
      "valid": true
    },
    {
      "affected_panels_candidate": [
        "A",
        "B",
        "C",
        "D",
        "E",
        "F"
      ],
      "errors": [],
      "evidence_level": "CONTEXT_ONLY",
      "lifecycle_status": "DRAFT",
      "publishable": false,
      "source_id": "OB-EA-PROCESS-CARD-L3-COM",
      "valid": true
    },
    {
      "affected_panels_candidate": [
        "A",
        "B",
        "C",
        "D",
        "E",
        "F"
      ],
      "errors": [],
      "evidence_level": "CONTEXT_ONLY",
      "lifecycle_status": "DRAFT",
      "publishable": false,
      "source_id": "OB-EA-PROCESS-CARD-L4-COM-01",
      "valid": true
    },
    {
      "affected_panels_candidate": [
        "A",
        "B",
        "C",
        "D",
        "E",
        "F"
      ],
      "errors": [],
      "evidence_level": "CONTEXT_ONLY",
      "lifecycle_status": "DRAFT",
      "publishable": false,
      "source_id": "OB-EA-PROCESS-CARD-L4-COM-02",
      "valid": true
    },
    {
      "affected_panels_candidate": [
        "A",
        "B",
        "C",
        "D",
        "E",
        "F"
      ],
      "errors": [],
      "evidence_level": "CONTEXT_ONLY",
      "lifecycle_status": "DRAFT",
      "publishable": false,
      "source_id": "OB-EA-PROCESS-CARD-L4-COM-03",
      "valid": true
    },
    {
      "affected_panels_candidate": [
        "A",
        "B",
        "C",
        "D",
        "E",
        "F"
      ],
      "errors": [],
      "evidence_level": "CONTEXT_ONLY",
      "lifecycle_status": "DRAFT",
      "publishable": false,
      "source_id": "OB-EA-PROCESS-CARD-L4-COM-04",
      "valid": true
    },
    {
      "affected_panels_candidate": [
        "A",
        "B",
        "C",
        "D",
        "E",
        "F"
      ],
      "errors": [],
      "evidence_level": "CONTEXT_ONLY",
      "lifecycle_status": "DRAFT",
      "publishable": false,
      "source_id": "OB-EA-PROCESS-CARD-L4-COM-05",
      "valid": true
    },
    {
      "affected_panels_candidate": [
        "A",
        "B",
        "C",
        "D",
        "E",
        "F"
      ],
      "errors": [],
      "evidence_level": "CONTEXT_ONLY",
      "lifecycle_status": "DRAFT",
      "publishable": false,
      "source_id": "OB-EA-PROCESS-CARD-L4-COM-06",
      "valid": true
    },
    {
      "affected_panels_candidate": [
        "A",
        "B",
        "C",
        "D",
        "E",
        "F"
      ],
      "errors": [],
      "evidence_level": "CONTEXT_ONLY",
      "lifecycle_status": "DRAFT",
      "publishable": false,
      "source_id": "OB-EA-PROCESS-CARD-L4-COM-07",
      "valid": true
    },
    {
      "affected_panels_candidate": [
        "A",
        "B",
        "C",
        "D",
        "E",
        "F"
      ],
      "errors": [],
      "evidence_level": "CONTEXT_ONLY",
      "lifecycle_status": "DRAFT",
      "publishable": false,
      "source_id": "OB-EA-PROCESS-CARD-L4-COM-08",
      "valid": true
    },
    {
      "affected_panels_candidate": [
        "A",
        "B",
        "C",
        "D",
        "E",
        "F"
      ],
      "errors": [],
      "evidence_level": "CONTEXT_ONLY",
      "lifecycle_status": "DRAFT",
      "publishable": false,
      "source_id": "OB-EA-PROCESS-CARD-L4-COM-09",
      "valid": true
    },
    {
      "affected_panels_candidate": [
        "A",
        "B",
        "C",
        "D",
        "E",
        "F"
      ],
      "errors": [],
      "evidence_level": "CONTEXT_ONLY",
      "lifecycle_status": "DRAFT",
      "publishable": false,
      "source_id": "OB-EA-PROCESS-CARD-L4-COM-10",
      "valid": true
    },
    {
      "affected_panels_candidate": [
        "A",
        "B",
        "C",
        "D",
        "E",
        "F"
      ],
      "errors": [],
      "evidence_level": "CONTEXT_ONLY",
      "lifecycle_status": "DRAFT",
      "publishable": false,
      "source_id": "OB-EA-PROCESS-CARD-L4-COM-11",
      "valid": true
    },
    {
      "affected_panels_candidate": [
        "A",
        "B",
        "C",
        "D",
        "E",
        "F"
      ],
      "errors": [],
      "evidence_level": "CONTEXT_ONLY",
      "lifecycle_status": "DRAFT",
      "publishable": false,
      "source_id": "OB-EA-PROCESS-CARD-L4-COM-12",
      "valid": true
    },
    {
      "affected_panels_candidate": [
        "A",
        "B",
        "C",
        "D",
        "E",
        "F"
      ],
      "errors": [],
      "evidence_level": "CONTEXT_ONLY",
      "lifecycle_status": "DRAFT",
      "publishable": false,
      "source_id": "OB-EA-PROCESS-CARD-L4-COM-13",
      "valid": true
    },
    {
      "affected_panels_candidate": [
        "A",
        "B",
        "C",
        "D",
        "E",
        "F"
      ],
      "errors": [],
      "evidence_level": "CONTEXT_ONLY",
      "lifecycle_status": "DRAFT",
      "publishable": false,
      "source_id": "OB-EA-PROCESS-CARD-L4-COM-14",
      "valid": true
    },
    {
      "affected_panels_candidate": [
        "A",
        "B",
        "C",
        "D",
        "E",
        "F"
      ],
      "errors": [],
      "evidence_level": "CONTEXT_ONLY",
      "lifecycle_status": "DRAFT",
      "publishable": false,
      "source_id": "OB-EA-PROCESS-CARD-L4-COM-15",
      "valid": true
    },
    {
      "affected_panels_candidate": [
        "A",
        "B",
        "C",
        "D",
        "E",
        "F"
      ],
      "errors": [],
      "evidence_level": "CONTEXT_ONLY",
      "lifecycle_status": "DRAFT",
      "publishable": false,
      "source_id": "OB-EA-PROCESS-CARD-L4-COM-16",
      "valid": true
    },
    {
      "affected_panels_candidate": [
        "A",
        "B",
        "C",
        "D",
        "E",
        "F"
      ],
      "errors": [],
      "evidence_level": "CONTEXT_ONLY",
      "lifecycle_status": "DRAFT",
      "publishable": false,
      "source_id": "OB-EA-PROCESS-CARD-L4-COM-17",
      "valid": true
    },
    {
      "affected_panels_candidate": [
        "A",
        "B",
        "C",
        "D",
        "E",
        "F"
      ],
      "errors": [],
      "evidence_level": "CONTEXT_ONLY",
      "lifecycle_status": "DRAFT",
      "publishable": false,
      "source_id": "OB-EA-PROCESS-CARD-L4-COM-18",
      "valid": true
    }
  ],
  "status": "READY_FOR_REVIEW",
  "summary": {
    "invalid": 0,
    "publishable": 5,
    "total": 24,
    "valid": 24
  }
}
